{
  "$schema": "./bootstrap-prompts.schema.json",
  "schemaVersion": 3,
  "repository": "Tairitsua/Monica",
  "skill": "monica-guide",
  "immutableRef": "{{MONICA_IMMUTABLE_REF}}",
  "catalogDigest": "{{MONICA_CATALOG_DIGEST}}",
  "distribution": {
    "skillsCli": {
      "package": "skills",
      "version": "1.5.21"
    },
    "immutableSkillUrlTemplate": "https://github.com/Tairitsua/Monica/tree/{tag}/skills/{skill}"
  },
  "verifiedAgentTargets": ["codex", "claude-code"],
  "fallback": {
    "installCommand": "npx --yes skills@1.5.21 add https://github.com/Tairitsua/Monica/tree/{{MONICA_IMMUTABLE_REF}}/skills/monica-guide -g -s monica-guide",
    "verifyCommand": "npx --yes skills@1.5.21 ls -g --json"
  },
  "locales": {
    "en-US": {
      "prompt": "Install only the monica-guide Agent Skill globally from this immutable source: https://github.com/Tairitsua/Monica/tree/{{MONICA_IMMUTABLE_REF}}/skills/monica-guide. Use this host's supported Agent Skills installation and discovery mechanism; if using the skills CLI, pin skills@1.5.21. This installation changes my user-level skill directory. Verify discovery and restart the host only if discovery still fails. Invoke $monica-guide, show its toolbox overview, global status, and Monica/Monica.Docs source bindings, then ask what I want to do next. After that installation, these restrictions apply until I choose an operation and approve its preview: Do not initialize a repository, choose a profile, install downstream Monica skills, bind or unbind source, make any other file changes, or perform remote mutations."
    },
    "zh-CN": {
      "prompt": "只从这个不可变来源全局安装 monica-guide Agent Skill：https://github.com/Tairitsua/Monica/tree/{{MONICA_IMMUTABLE_REF}}/skills/monica-guide。使用当前宿主支持的 Agent Skills 安装与发现方式；若使用 skills CLI，请固定 skills@1.5.21。这次安装会更改我的用户级 Skill 目录。请验证发现结果，只有发现仍失败时才重启宿主。调用 $monica-guide，介绍其工具箱、全局状态以及 Monica 和 Monica.Docs 源码绑定，再询问我下一步想做什么。完成这次安装后，在我选择操作并批准其预览之前，以下限制适用：不要初始化仓库、选择 profile、安装后续 Monica Skill、绑定或解绑源码、不要再修改其他文件或执行远程变更。"
    }
  }
}
